{
  "$schema": "https://json-schema.org/draft/2020-12/schema",
  "$id": "https://raw.githubusercontent.com/dkharlanau/agent-ready-web-profile/main/schema/site-profile.schema.json",
  "title": "Agent-Ready Web Profile v0.1",
  "description": "Discovery profile for a website's existing web, data, retrieval and agent-facing interfaces.",
  "type": "object",
  "additionalProperties": false,
  "required": ["profileVersion", "id", "name", "canonicalUrl", "description"],
  "properties": {
    "$schema": { "type": "string", "format": "uri" },
    "profileVersion": { "const": "0.1" },
    "id": {
      "type": "string",
      "minLength": 2,
      "maxLength": 128,
      "pattern": "^[A-Za-z0-9][A-Za-z0-9._:-]*$"
    },
    "name": { "type": "string", "minLength": 1, "maxLength": 200 },
    "canonicalUrl": { "type": "string", "format": "uri", "pattern": "^https://" },
    "description": { "type": "string", "minLength": 1, "maxLength": 1000 },
    "languages": {
      "type": "array",
      "items": {
        "type": "string",
        "minLength": 2,
        "maxLength": 35,
        "pattern": "^[A-Za-z]{2,8}(-[A-Za-z0-9]{1,8})*$"
      },
      "uniqueItems": true
    },
    "adoption": { "$ref": "#/$defs/adoption" },
    "web": { "$ref": "#/$defs/web" },
    "data": { "$ref": "#/$defs/data" },
    "retrieval": { "$ref": "#/$defs/retrieval" },
    "agentSkills": { "$ref": "#/$defs/agentSkills" },
    "agentWeb": { "$ref": "#/$defs/agentWeb" },
    "mcp": { "$ref": "#/$defs/mcp" },
    "a2a": { "$ref": "#/$defs/a2a" },
    "identity": { "$ref": "#/$defs/identity" },
    "trust": { "$ref": "#/$defs/trust" },
    "extensions": {
      "type": "object",
      "propertyNames": { "pattern": "^[a-z0-9][a-z0-9.-]*/[A-Za-z0-9._-]+$" },
      "additionalProperties": true
    }
  },
  "allOf": [
    {
      "if": {
        "required": ["adoption"],
        "properties": {
          "adoption": {
            "required": ["level"],
            "properties": {
              "level": { "const": "full-publisher" }
            }
          }
        }
      },
      "then": {
        "required": ["languages", "web", "identity", "trust"],
        "properties": {
          "web": {
            "required": ["sitemap", "robots", "llms"]
          },
          "identity": {
            "required": ["namespace", "idPattern"]
          },
          "trust": {
            "required": [
              "publisher",
              "license",
              "citation",
              "provenance",
              "reviewPolicy",
              "privacy",
              "accessibility",
              "contact",
              "corrections",
              "security"
            ]
          }
        }
      }
    }
  ],
  "$defs": {
    "httpsUri": {
      "type": "string",
      "format": "uri",
      "pattern": "^https://"
    },
    "adoption": {
      "type": "object",
      "additionalProperties": false,
      "required": ["level"],
      "properties": {
        "level": {
          "type": "string",
          "enum": ["core", "full-publisher"]
        },
        "reviewedAt": {
          "type": "string",
          "format": "date"
        }
      }
    },
    "feed": {
      "type": "object",
      "additionalProperties": false,
      "required": ["url", "mediaType"],
      "properties": {
        "url": { "$ref": "#/$defs/httpsUri" },
        "mediaType": { "type": "string", "minLength": 3, "maxLength": 100 },
        "title": { "type": "string", "maxLength": 200 }
      }
    },
    "distribution": {
      "type": "object",
      "additionalProperties": false,
      "required": ["name", "url", "mediaType"],
      "properties": {
        "name": { "type": "string", "minLength": 1, "maxLength": 100 },
        "url": { "$ref": "#/$defs/httpsUri" },
        "mediaType": { "type": "string", "minLength": 3, "maxLength": 100 },
        "role": {
          "type": "string",
          "enum": ["canonical-data", "catalog", "rag", "search-index", "evaluation", "release", "other"]
        },
        "description": { "type": "string", "maxLength": 500 }
      }
    },
    "web": {
      "type": "object",
      "additionalProperties": false,
      "properties": {
        "sitemap": { "$ref": "#/$defs/httpsUri" },
        "robots": { "$ref": "#/$defs/httpsUri" },
        "llms": { "$ref": "#/$defs/httpsUri" },
        "manifest": { "$ref": "#/$defs/httpsUri" },
        "feeds": {
          "type": "array",
          "items": { "$ref": "#/$defs/feed" },
          "uniqueItems": true
        },
        "markdownIndex": { "$ref": "#/$defs/httpsUri" }
      }
    },
    "data": {
      "type": "object",
      "additionalProperties": false,
      "properties": {
        "catalog": { "$ref": "#/$defs/httpsUri" },
        "schemas": { "$ref": "#/$defs/httpsUri" },
        "openapi": { "$ref": "#/$defs/httpsUri" },
        "releases": { "$ref": "#/$defs/httpsUri" },
        "croissant": { "$ref": "#/$defs/httpsUri" },
        "distributions": {
          "type": "array",
          "items": { "$ref": "#/$defs/distribution" }
        }
      }
    },
    "retrievalIndex": {
      "type": "object",
      "additionalProperties": false,
      "required": ["name", "url", "mediaType"],
      "properties": {
        "name": { "type": "string", "minLength": 1, "maxLength": 100 },
        "url": { "$ref": "#/$defs/httpsUri" },
        "mediaType": { "type": "string", "minLength": 3, "maxLength": 100 },
        "format": { "type": "string", "enum": ["json", "jsonl", "ndjson", "csv", "parquet", "other"] },
        "description": { "type": "string", "maxLength": 500 }
      }
    },
    "retrieval": {
      "type": "object",
      "additionalProperties": false,
      "properties": {
        "indexes": {
          "type": "array",
          "items": { "$ref": "#/$defs/retrievalIndex" }
        },
        "search": { "$ref": "#/$defs/httpsUri" },
        "abstention": { "$ref": "#/$defs/httpsUri" }
      }
    },
    "agentSkill": {
      "type": "object",
      "additionalProperties": false,
      "required": ["name", "url"],
      "properties": {
        "name": {
          "type": "string",
          "minLength": 1,
          "maxLength": 64,
          "pattern": "^[a-z0-9]+(?:-[a-z0-9]+)*$"
        },
        "url": { "$ref": "#/$defs/httpsUri" },
        "version": { "type": "string", "minLength": 1, "maxLength": 100 },
        "description": { "type": "string", "maxLength": 1024 },
        "source": { "$ref": "#/$defs/httpsUri" }
      }
    },
    "agentSkills": {
      "type": "object",
      "additionalProperties": false,
      "properties": {
        "catalog": { "$ref": "#/$defs/httpsUri" },
        "specification": { "$ref": "#/$defs/httpsUri" },
        "skills": {
          "type": "array",
          "items": { "$ref": "#/$defs/agentSkill" }
        }
      },
      "anyOf": [
        { "required": ["catalog"] },
        { "required": ["skills"] }
      ]
    },
    "webmcp": {
      "type": "object",
      "additionalProperties": false,
      "required": ["enabled"],
      "properties": {
        "enabled": { "type": "boolean" },
        "pages": {
          "type": "array",
          "items": { "$ref": "#/$defs/httpsUri" },
          "uniqueItems": true,
          "minItems": 1
        },
        "documentation": { "$ref": "#/$defs/httpsUri" },
        "tools": {
          "type": "array",
          "items": { "type": "string", "minLength": 1, "maxLength": 100 },
          "uniqueItems": true
        }
      },
      "allOf": [
        {
          "if": { "properties": { "enabled": { "const": true } }, "required": ["enabled"] },
          "then": { "required": ["pages"] }
        }
      ]
    },
    "agentWeb": {
      "type": "object",
      "additionalProperties": false,
      "properties": {
        "webmcp": { "$ref": "#/$defs/webmcp" }
      }
    },
    "mcpServer": {
      "type": "object",
      "additionalProperties": false,
      "required": ["name", "transport"],
      "properties": {
        "name": { "type": "string", "minLength": 1, "maxLength": 200 },
        "transport": { "type": "string", "enum": ["streamable-http", "stdio", "sse", "other"] },
        "url": { "$ref": "#/$defs/httpsUri" },
        "package": { "type": "string", "minLength": 1, "maxLength": 300 },
        "source": { "$ref": "#/$defs/httpsUri" },
        "registry": { "$ref": "#/$defs/httpsUri" },
        "documentation": { "$ref": "#/$defs/httpsUri" },
        "readOnly": { "type": "boolean" }
      },
      "allOf": [
        {
          "if": { "properties": { "transport": { "const": "streamable-http" } }, "required": ["transport"] },
          "then": { "required": ["url"] }
        },
        {
          "if": { "properties": { "transport": { "const": "stdio" } }, "required": ["transport"] },
          "then": {
            "anyOf": [
              { "required": ["package"] },
              { "required": ["source"] }
            ]
          }
        }
      ]
    },
    "mcp": {
      "type": "object",
      "additionalProperties": false,
      "required": ["servers"],
      "properties": {
        "servers": {
          "type": "array",
          "minItems": 1,
          "items": { "$ref": "#/$defs/mcpServer" }
        }
      }
    },
    "a2a": {
      "type": "object",
      "additionalProperties": false,
      "required": ["agentCard"],
      "properties": {
        "agentCard": { "$ref": "#/$defs/httpsUri" }
      }
    },
    "identity": {
      "type": "object",
      "additionalProperties": false,
      "properties": {
        "namespace": { "type": "string", "minLength": 1, "maxLength": 100 },
        "idPattern": { "type": "string", "minLength": 1, "maxLength": 300 },
        "aliases": { "$ref": "#/$defs/httpsUri" }
      }
    },
    "trust": {
      "type": "object",
      "additionalProperties": false,
      "properties": {
        "publisher": { "$ref": "#/$defs/httpsUri" },
        "license": { "$ref": "#/$defs/httpsUri" },
        "citation": { "$ref": "#/$defs/httpsUri" },
        "provenance": { "$ref": "#/$defs/httpsUri" },
        "reviewPolicy": { "$ref": "#/$defs/httpsUri" },
        "privacy": { "$ref": "#/$defs/httpsUri" },
        "accessibility": { "$ref": "#/$defs/httpsUri" },
        "contact": { "$ref": "#/$defs/httpsUri" },
        "corrections": { "$ref": "#/$defs/httpsUri" },
        "security": { "$ref": "#/$defs/httpsUri" },
        "terms": { "$ref": "#/$defs/httpsUri" }
      }
    }
  }
}
