{
  "$schema": "https://raw.githubusercontent.com/dkharlanau/agent-ready-web-profile/main/schema/site-profile.schema.json",
  "profileVersion": "0.1",
  "id": "dkharlanau-sap-knowledge",
  "name": "Dzmitryi Kharlanau — SAP AMS & AI-Ready Support Knowledge",
  "canonicalUrl": "https://dkharlanau.github.io/",
  "description": "Public professional SAP AMS diagnostics and support knowledge site with structured datasets, retrieval indexes, agent-skill routing and local read-only MCP implementations.",
  "languages": ["en"],
  "web": {
    "sitemap": "https://dkharlanau.github.io/sitemap.xml",
    "robots": "https://dkharlanau.github.io/robots.txt",
    "llms": "https://dkharlanau.github.io/llms.txt"
  },
  "data": {
    "catalog": "https://dkharlanau.github.io/ai/catalog.json",
    "schemas": "https://dkharlanau.github.io/datasets/schema.json",
    "distributions": [
      {
        "name": "Dataset manifest",
        "url": "https://dkharlanau.github.io/datasets/manifest.json",
        "mediaType": "application/json",
        "role": "catalog",
        "description": "Public dataset manifest for the professional knowledge site."
      },
      {
        "name": "SAP Atlas compact index",
        "url": "https://dkharlanau.github.io/ai/atlas-compact-index.json",
        "mediaType": "application/json",
        "role": "search-index",
        "description": "Compact structured index over public SAP Atlas material."
      }
    ]
  },
  "retrieval": {
    "indexes": [
      {
        "name": "SAP Atlas compact index",
        "url": "https://dkharlanau.github.io/ai/atlas-compact-index.json",
        "mediaType": "application/json",
        "format": "json",
        "description": "Compact public retrieval index over reviewed SAP Atlas content."
      }
    ],
    "search": "https://dkharlanau.github.io/datasets/search/"
  },
  "agentSkills": {
    "catalog": "https://dkharlanau.github.io/.well-known/agent-skills/index.json",
    "specification": "https://agentskills.io/specification"
  },
  "mcp": {
    "servers": [
      {
        "name": "sap-diagnostics-mcp",
        "transport": "stdio",
        "source": "https://github.com/dkharlanau/dkharlanau.github.io/tree/main/mcp/sap-diagnostics-mcp",
        "documentation": "https://github.com/dkharlanau/dkharlanau.github.io/tree/main/mcp/sap-diagnostics-mcp",
        "readOnly": true
      },
      {
        "name": "sap-assessment-mcp",
        "transport": "stdio",
        "source": "https://github.com/dkharlanau/dkharlanau.github.io/tree/main/mcp/sap-assessment-mcp",
        "documentation": "https://github.com/dkharlanau/dkharlanau.github.io/tree/main/mcp/sap-assessment-mcp",
        "readOnly": true
      }
    ]
  },
  "trust": {
    "license": "https://dkharlanau.github.io/LICENSE",
    "citation": "https://dkharlanau.github.io/CITATION/"
  }
}
